{
  "schemaVersion": 1,
  "generatedAtUtc": "2026-07-03T03:00:34.7628686Z",
  "solutionPath": "RoslynKit.slnx",
  "projects": [
    {
      "name": "RoslynKit",
      "path": "src/RoslynKit/RoslynKit.csproj",
      "category": "source",
      "isTestProject": false,
      "includedInSolution": true
    },
    {
      "name": "App",
      "path": "tests/FixtureWorkspace/App/App.csproj",
      "category": "fixture",
      "isTestProject": false,
      "includedInSolution": false
    },
    {
      "name": "RoslynKit.AtlasPromptCacheProbe",
      "path": "tests/RoslynKit.AtlasPromptCacheProbe/RoslynKit.AtlasPromptCacheProbe.csproj",
      "category": "test-support",
      "isTestProject": false,
      "includedInSolution": true
    },
    {
      "name": "RoslynKit.Tests",
      "path": "tests/RoslynKit.Tests/RoslynKit.Tests.csproj",
      "category": "test",
      "isTestProject": true,
      "includedInSolution": true
    },
    {
      "name": "RoslynKit.WorkspaceGraphDump",
      "path": "tests/RoslynKit.WorkspaceGraphDump/RoslynKit.WorkspaceGraphDump.csproj",
      "category": "test-support",
      "isTestProject": false,
      "includedInSolution": true
    }
  ]
}
